{
  "contractVersion": "0.1.0",
  "id": "com.example.openai-metadata",
  "name": "Example OpenAI Metadata",
  "version": "0.1.0",
  "publisher": {
    "name": "Example Labs",
    "url": "https://example.com"
  },
  "description": "Adds provider metadata and a static model catalog source.",
  "homepage": "https://example.com/gettokens-extension",
  "source": {
    "type": "local",
    "uri": "file:///Users/me/extensions/openai-metadata",
    "revision": "local"
  },
  "compatibility": {
    "gettokens": ">=0.0.0",
    "sidecarContract": "^0.1.0",
    "capabilityContract": "^0.1.0"
  },
  "permissions": [
    "provider.metadata.read",
    "model.catalog.read",
    "network.fetch.declared-endpoints"
  ],
  "capabilities": [
    {
      "id": "openai-provider-metadata",
      "kind": "provider-metadata",
      "provider": {
        "id": "openai",
        "displayName": "OpenAI",
        "family": "openai-compatible",
        "homepage": "https://platform.openai.com",
        "contributionMode": "augment"
      },
      "endpoints": [
        {
          "id": "default-api",
          "baseUrl": "https://api.openai.com/v1",
          "protocol": "openai-compatible",
          "auth": "bearer-token"
        }
      ],
      "ui": {
        "accent": "#111827",
        "docsUrl": "https://platform.openai.com/docs"
      }
    },
    {
      "id": "openai-model-catalog",
      "kind": "model-catalog-source",
      "providerId": "openai",
      "source": {
        "type": "static-json",
        "path": "models/openai-models.json"
      },
      "models": [
        {
          "id": "gpt-4.1",
          "displayName": "GPT-4.1",
          "inputModalities": [
            "text",
            "image"
          ],
          "outputModalities": [
            "text"
          ],
          "contextWindow": 1047576,
          "status": "available",
          "docsUrl": "https://platform.openai.com/docs/models"
        }
      ],
      "contributionMode": "augment",
      "priority": 100
    }
  ],
  "metadata": {
    "labels": [
      "local",
      "declarative"
    ],
    "supportContact": "support@example.com"
  }
}
